{
  "schema_version": 1,
  "desk": "solana",
  "mode": "log_only",
  "buy_signal": false,
  "note": "Log only. This file does not change entries or exits. Wallet ids are w- hashes. buy_signal is false.",
  "at": "2026-10-28T02:07:00Z",
  "rows": [
    {
      "mint": "DUxnHraorABWJEno1RQRW4vvxJq1CFoXJ7izVLQtpump",
      "code": "known_rugger",
      "rugger_id": "r-0123abcd0123",
      "evidence_tags": ["rugcheck_rugged"]
    },
    {
      "mint": "DUxnHraorABWJEno1RQRW4vvxJq1CFoXJ7izVLQtpump",
      "code": "known_rugger_funded",
      "rugger_id": "r-0123abcd0123",
      "wallet_id": "r-89abcdef0123",
      "evidence_tags": ["rugcheck_rugged"],
      "hop": 1
    }
  ]
}
